{
  "$schema": "https://manifests.lumoria.dev/1/schemas/redist.json",
  "id": "ipamona",
  "name": "IPAMona Fonts",
  "downloads": [
    {
      "id": "ipamona_archive",
      "url": "https://share.lumoria.dev/redists/ipamona/opfc-ModuleHP-1.1.1_withIPAMonaFonts-1.0.8.tar.gz",
      "dest": "${var.CACHE_REDIST}/ipamona/opfc-ModuleHP-1.1.1_withIPAMonaFonts-1.0.8.tar.gz",
      "sha256": "ab77beea3b051abf606cd8cd3badf6cb24141ef145c60f508fcfef1e3852bb9d"
    }
  ],
  "steps": [
    {
      "type": "fonts",
      "description": "Install IPAMona fonts",
      "dst": "${var.FONTS}",
      "args": [
        "${var.CACHE_REDIST}/ipamona/opfc-ModuleHP-1.1.1_withIPAMonaFonts-1.0.8.tar.gz"
      ],
      "font_registrations": [
        "ipagui-mona.ttf|IPAMonaUIGothic",
        "ipag-mona.ttf|IPAMonaGothic",
        "ipagp-mona.ttf|IPAMonaPGothic",
        "ipam-mona.ttf|IPAMonaMincho",
        "ipamp-mona.ttf|IPAMonaPMincho"
      ],
      "when": {
        "not": {
          "file_exists": "${var.FONTS}/ipag-mona.ttf"
        }
      }
    }
  ]
}
