{
  "$schema": "https://manifests.lumoria.dev/1/schemas/redist.json",
  "id": "d3dcompiler_46",
  "name": "d3dcompiler_46",
  "downloads": [
    {
      "id": "d3dcompiler_46_x86",
      "url": "https://download.microsoft.com/download/F/1/3/F1300C9C-A120-4341-90DF-8A52509B23AC/standalonesdk/Installers/2630bae9681db6a9f6722366f47d055c.cab",
      "dest": "${var.CACHE_REDIST}/d3dcompiler_46/d3dcompiler_46_x86.cab",
      "sha256": "359ff931beaeb24f0493099baceddfdb27876617dc5057e86742de652faf1d38"
    },
    {
      "id": "d3dcompiler_46_x64",
      "url": "https://download.microsoft.com/download/F/1/3/F1300C9C-A120-4341-90DF-8A52509B23AC/standalonesdk/Installers/61d57a7a82309cd161a854a6f4619e52.cab",
      "dest": "${var.CACHE_REDIST}/d3dcompiler_46/d3dcompiler_46_x64.cab",
      "sha256": "e3e05076784fed086203eff7c5ff4b406bbd2e649fd938eb73c1b7d05f49cdfc",
      "when": {
        "var": {
          "ARCH": "win64"
        }
      }
    }
  ],
  "steps": [
    {
      "type": "dll_override",
      "description": "Set d3dcompiler_46 to native",
      "command": "d3dcompiler_46",
      "mode": "native"
    },
    {
      "type": "cabextract",
      "description": "Extract d3dcompiler_46.dll (x86 -> syswow64)",
      "src": "${var.CACHE_REDIST}/d3dcompiler_46/d3dcompiler_46_x86.cab",
      "args": [
        "fil47ed91e900f4b9d9659b66a211b57c39"
      ],
      "dst": "${var.SYSWOW64}/d3dcompiler_46.dll",
      "when": {
        "var": {
          "ARCH": "win64"
        }
      }
    },
    {
      "type": "cabextract",
      "description": "Extract d3dcompiler_46.dll (x86 -> system32)",
      "src": "${var.CACHE_REDIST}/d3dcompiler_46/d3dcompiler_46_x86.cab",
      "args": [
        "fil47ed91e900f4b9d9659b66a211b57c39"
      ],
      "dst": "${var.SYSTEM32}/d3dcompiler_46.dll",
      "when": {
        "var": {
          "ARCH": "win32"
        }
      }
    },
    {
      "type": "cabextract",
      "description": "Extract d3dcompiler_46.dll (x64 -> system32)",
      "src": "${var.CACHE_REDIST}/d3dcompiler_46/d3dcompiler_46_x64.cab",
      "args": [
        "fil8c20206095817436f8df4a711faee5b7"
      ],
      "dst": "${var.SYSTEM32}/d3dcompiler_46.dll",
      "when": {
        "var": {
          "ARCH": "win64"
        }
      }
    }
  ]
}
