{
  "$schema": "https://manifests.lumoria.dev/1/schemas/redist.json",
  "id": "wenquanyi",
  "name": "WenQuanYi Micro Hei",
  "downloads": [
    {
      "id": "wenquanyi_archive",
      "url": "https://downloads.sourceforge.net/wqy/wqy-microhei-0.2.0-beta.tar.gz",
      "dest": "${var.CACHE_REDIST}/wenquanyi/wqy-microhei-0.2.0-beta.tar.gz",
      "sha256": "2802ac8023aa36a66ea6e7445854e3a078d377ffff42169341bd237871f7213e"
    }
  ],
  "steps": [
    {
      "type": "fonts",
      "description": "Install WenQuanYi Micro Hei",
      "dst": "${var.FONTS}",
      "args": [
        "${var.CACHE_REDIST}/wenquanyi/wqy-microhei-0.2.0-beta.tar.gz"
      ],
      "font_registrations": [
        "wqy-microhei.ttc|WenQuanYi Micro Hei"
      ],
      "when": {
        "not": {
          "file_exists": "${var.FONTS}/wqy-microhei.ttc"
        }
      }
    }
  ]
}
