{
  "id": "d3dcompiler_47",
  "name": "d3dcompiler_47",
  "downloads": [
    {
      "id": "d3dcompiler_47_x86",
      "url": "https://download.microsoft.com/download/B/0/C/B0C80BA3-8AD6-4958-810B-6882485230B5/standalonesdk/Installers/2630bae9681db6a9f6722366f47d055c.cab",
      "dest": "${var.CACHE_REDIST}/d3dcompiler_47/d3dcompiler_47_x86.cab",
      "sha256": "d0440eb81c532dc23639c0c63f2fcde9deddb23bb4cce01c19ac6b96cc3e269d"
    },
    {
      "id": "d3dcompiler_47_x64",
      "url": "https://download.microsoft.com/download/B/0/C/B0C80BA3-8AD6-4958-810B-6882485230B5/standalonesdk/Installers/61d57a7a82309cd161a854a6f4619e52.cab",
      "dest": "${var.CACHE_REDIST}/d3dcompiler_47/d3dcompiler_47_x64.cab",
      "sha256": "f736e161547095bb8d98c636b85fdfeb4070fefeee3c3745db3ce88f6eb1d9de",
      "when": {
        "var": {
          "ARCH": "win64"
        }
      }
    }
  ],
  "steps": [
    {
      "type": "dll_override",
      "description": "Set d3dcompiler_47 to native",
      "command": "d3dcompiler_47",
      "mode": "native"
    },
    {
      "type": "cabextract",
      "description": "Extract d3dcompiler_47.dll (x86 -> syswow64)",
      "src": "${var.CACHE_REDIST}/d3dcompiler_47/d3dcompiler_47_x86.cab",
      "args": [
        "fila319f706acfa16d6707473ebf29bdc7f"
      ],
      "dst": "${var.SYSWOW64}/d3dcompiler_47.dll",
      "when": {
        "var": {
          "ARCH": "win64"
        }
      }
    },
    {
      "type": "cabextract",
      "description": "Extract d3dcompiler_47.dll (x86 -> system32)",
      "src": "${var.CACHE_REDIST}/d3dcompiler_47/d3dcompiler_47_x86.cab",
      "args": [
        "fila319f706acfa16d6707473ebf29bdc7f"
      ],
      "dst": "${var.SYSTEM32}/d3dcompiler_47.dll",
      "when": {
        "var": {
          "ARCH": "win32"
        }
      }
    },
    {
      "type": "cabextract",
      "description": "Extract d3dcompiler_47.dll (x64 -> system32)",
      "src": "${var.CACHE_REDIST}/d3dcompiler_47/d3dcompiler_47_x64.cab",
      "args": [
        "fil3585cb2ea5db13cc0838f8d06b5c9679"
      ],
      "dst": "${var.SYSTEM32}/d3dcompiler_47.dll",
      "when": {
        "var": {
          "ARCH": "win64"
        }
      }
    }
  ]
}
