{
  "id": "corefonts",
  "name": "Core Fonts",
  "downloads": [
    {
      "id": "font_arial",
      "url": "https://github.com/pushcx/corefonts/raw/master/arial32.exe",
      "dest": "${var.CACHE_REDIST}/corefonts/arial32.exe",
      "sha256": "85297a4d146e9c87ac6f74822734bdee5f4b2a722d7eaa584b7f2cbf76f478f6"
    },
    {
      "id": "font_arialb",
      "url": "https://github.com/pushcx/corefonts/raw/master/arialb32.exe",
      "dest": "${var.CACHE_REDIST}/corefonts/arialb32.exe",
      "sha256": "a425f0ffb6a1a5ede5b979ed6177f4f4f4fdef6ae7c302a7b7720ef332fec0a8"
    },
    {
      "id": "font_comic",
      "url": "https://github.com/pushcx/corefonts/raw/master/comic32.exe",
      "dest": "${var.CACHE_REDIST}/corefonts/comic32.exe",
      "sha256": "9c6df3feefde26d4e41d4a4fe5db2a89f9123a772594d7f59afd062625cd204e"
    },
    {
      "id": "font_courier",
      "url": "https://github.com/pushcx/corefonts/raw/master/courie32.exe",
      "dest": "${var.CACHE_REDIST}/corefonts/courie32.exe",
      "sha256": "bb511d861655dde879ae552eb86b134d6fae67cb58502e6ff73ec5d9151f3384"
    },
    {
      "id": "font_georgia",
      "url": "https://github.com/pushcx/corefonts/raw/master/georgi32.exe",
      "dest": "${var.CACHE_REDIST}/corefonts/georgi32.exe",
      "sha256": "2c2c7dcda6606ea5cf08918fb7cd3f3359e9e84338dc690013f20cd42e930301"
    },
    {
      "id": "font_impact",
      "url": "https://github.com/pushcx/corefonts/raw/master/impact32.exe",
      "dest": "${var.CACHE_REDIST}/corefonts/impact32.exe",
      "sha256": "6061ef3b7401d9642f5dfdb5f2b376aa14663f6275e60a51207ad4facf2fccfb"
    },
    {
      "id": "font_times",
      "url": "https://github.com/pushcx/corefonts/raw/master/times32.exe",
      "dest": "${var.CACHE_REDIST}/corefonts/times32.exe",
      "sha256": "db56595ec6ef5d3de5c24994f001f03b2a13e37cee27bc25c58f6f43e8f807ab"
    },
    {
      "id": "font_trebuchet",
      "url": "https://github.com/pushcx/corefonts/raw/master/trebuc32.exe",
      "dest": "${var.CACHE_REDIST}/corefonts/trebuc32.exe",
      "sha256": "5a690d9bb8510be1b8b4fe49f1f2319651fe51bbe54775ddddd8ef0bd07fdac9"
    },
    {
      "id": "font_verdana",
      "url": "https://github.com/pushcx/corefonts/raw/master/verdan32.exe",
      "dest": "${var.CACHE_REDIST}/corefonts/verdan32.exe",
      "sha256": "c1cb61255e363166794e47664e2f21af8e3a26cb6346eb8d2ae2fa85dd5aad96"
    },
    {
      "id": "font_webdings",
      "url": "https://github.com/pushcx/corefonts/raw/master/webdin32.exe",
      "dest": "${var.CACHE_REDIST}/corefonts/webdin32.exe",
      "sha256": "64595b5abc1080fba8610c5c34fab5863408e806aafe84653ca8575bed17d75a"
    }
  ],
  "steps": [
    {
      "type": "fonts",
      "description": "Install core fonts",
      "dst": "${var.FONTS}",
      "args": [
        "${var.CACHE_REDIST}/corefonts/arial32.exe",
        "${var.CACHE_REDIST}/corefonts/arialb32.exe",
        "${var.CACHE_REDIST}/corefonts/comic32.exe",
        "${var.CACHE_REDIST}/corefonts/courie32.exe",
        "${var.CACHE_REDIST}/corefonts/georgi32.exe",
        "${var.CACHE_REDIST}/corefonts/impact32.exe",
        "${var.CACHE_REDIST}/corefonts/times32.exe",
        "${var.CACHE_REDIST}/corefonts/trebuc32.exe",
        "${var.CACHE_REDIST}/corefonts/verdan32.exe",
        "${var.CACHE_REDIST}/corefonts/webdin32.exe"
      ],
      "font_registrations": [
        "arial.ttf|Arial",
        "arialbd.ttf|Arial Bold",
        "arialbi.ttf|Arial Bold Italic",
        "ariali.ttf|Arial Italic",
        "ariblk.ttf|Arial Black",
        "comic.ttf|Comic Sans MS",
        "comicbd.ttf|Comic Sans MS Bold",
        "cour.ttf|Courier New",
        "courbd.ttf|Courier New Bold",
        "courbi.ttf|Courier New Bold Italic",
        "couri.ttf|Courier New Italic",
        "georgia.ttf|Georgia",
        "georgiab.ttf|Georgia Bold",
        "georgiai.ttf|Georgia Italic",
        "georgiaz.ttf|Georgia Bold Italic",
        "impact.ttf|Impact",
        "times.ttf|Times New Roman",
        "timesbd.ttf|Times New Roman Bold",
        "timesbi.ttf|Times New Roman Bold Italic",
        "timesi.ttf|Times New Roman Italic",
        "trebuc.ttf|Trebuchet MS",
        "trebucbd.ttf|Trebuchet MS Bold",
        "trebucbi.ttf|Trebuchet MS Bold Italic",
        "trebucit.ttf|Trebuchet MS Italic",
        "verdana.ttf|Verdana",
        "verdanab.ttf|Verdana Bold",
        "verdanai.ttf|Verdana Italic",
        "verdanaz.ttf|Verdana Bold Italic",
        "webdings.ttf|Webdings"
      ],
      "when": {
        "not": {
          "file_exists": "${var.FONTS}/arial.ttf"
        }
      }
    }
  ]
}
